{"absent_roots":[{"canonical_path":"/home/ollie/.local/state/orchestrator/es-f1-large-scope-refreeze-feasibility-capture-v1/source-full","lstat":"absent","root_id":"root-fe282af17fa48966649eade6b828a071"},{"canonical_path":"/home/ollie/.local/state/orchestrator/es-f1-large-scope-refreeze-feasibility-capture-v1/source-test-only","lstat":"absent","root_id":"root-8abe453eff7ee775f7f5d6360d162ab4"},{"canonical_path":"/home/ollie/.local/state/orchestrator/es-f1-large-scope-refreeze-feasibility-capture-v1/source-remove-one-identity-config","lstat":"absent","root_id":"root-b3fa47b0cd8212575843739f4fd9cd1e"},{"canonical_path":"/home/ollie/.local/state/orchestrator/es-f1-large-scope-refreeze-feasibility-capture-v1/source-remove-one-construction-adapters","lstat":"absent","root_id":"root-0e79e763e4240489e54e2a320c99cfd1"},{"canonical_path":"/home/ollie/.local/state/orchestrator/es-f1-large-scope-refreeze-feasibility-capture-v1/source-remove-one-persistence-rebuild","lstat":"absent","root_id":"root-185b27fdc5609ee1ef880efdc73c06cd"},{"canonical_path":"/home/ollie/.local/state/orchestrator/es-f1-large-scope-refreeze-feasibility-capture-v1/source-remove-one-inference-workflows","lstat":"absent","root_id":"root-b5daf641a6522203276955aa0a785a12"},{"canonical_path":"/home/ollie/.local/state/orchestrator/es-f1-large-scope-refreeze-feasibility-capture-v1/objects.git","lstat":"absent","root_id":"root-802ab499309ecd24a309dacf484292db"}],"capture_manifest":{"path":"docs/plans/evidence/es-f1-large-scope-refreeze/feasibility-capture-manifest.json","sha256":"sha256:8b06003d84691a9bab5c6ffccf3f1a0723cc056da1503cffe60c580ee43c2667"},"evidence_status":"purged_after_ordered_reviews","purged_at":"2026-08-05T00:45:58-07:00","record_sha256":"sha256:74655fc1682ed13bfeeaefd25604403b1fa95c79072564b8abf3b6b81f9cffb2","reviews":[{"path":"artifacts/review/es-f1-large-scope-amendment-plan-specification-review.md","review_kind":"specification","sha256":"sha256:8fbbc1cbab8f50d86f7c3e5e45c26d3b95bee59e9090fb25f7f71b8d39a3f0a7"},{"path":"artifacts/review/es-f1-large-scope-amendment-plan-quality-review.md","review_kind":"quality","sha256":"sha256:110d05e8755846d16bdd1b50829d76fce39524ffa7f2269198a2a41933783f0d"}],"schema_version":"es_f1_feasibility_post_purge_tombstone.v1"}
